{
  "$schema": "http://json-schema.org/draft-07/schema#",
  "$id": "https://libv2.local/schema/vector_index_manifest.schema.json",
  "title": "Vector Index Manifest",
  "description": "Provenance + integrity manifest for the on-device vector index emitted alongside embeddings.npy + id_map.json at LibV2/courses/<slug>/vector_index/manifest.json. Mirrors the conventions of chunkset_manifest.schema.json (lowercase-hex SHA fields, chunker_version alternation, additionalProperties:false). The manifest pins every replay parameter (model id/revision/dim, provider, device, batch_size, text_field_policy) so a vector index built on one machine is auditable on another and an eval run can refuse mixed-provenance comparisons. The content-hashed sections (embeddings_sha256 / id_map_sha256 / source_chunks_sha256) carry no timestamps so a rebuild over identical inputs is byte-stable; the optional generated_at field is deliberately EXCLUDED from the determinism contract. Validated by lib/validators/vector_index_manifest.py::VectorIndexManifestValidator; query-time staleness (source_chunks_sha256 vs the live chunkset) is enforced fail-closed by LibV2/tools/libv2/retrieval/vector_index.py::load_vector_index.",
  "type": "object",
  "required": [
    "schema_version",
    "embedding_provider",
    "embedding_kind",
    "embedding_model_id",
    "embedding_dim",
    "normalized",
    "index_type",
    "chunker_version",
    "chunkset_kind",
    "source_chunks_sha256",
    "embeddings_sha256",
    "id_map_sha256",
    "chunks_count",
    "text_field_policy",
    "batch_size",
    "device"
  ],
  "properties": {
    "schema_version": {
      "type": "string",
      "const": "1.0",
      "description": "Manifest schema version. Const '1.0' in this revision; bumped only when the manifest emit shape changes."
    },
    "embedding_provider": {
      "type": "string",
      "minLength": 1,
      "description": "Embedding provider registry key (lib.embedding.providers._EMBEDDING_PROVIDERS), e.g. 'st', 'local-openai', 'fake'. The query path refuses a manifest with embedding_provider=='fake' unless ED4ALL_EMBEDDING_ALLOW_FAKE is set (anti-production-poisoning)."
    },
    "embedding_kind": {
      "type": "string",
      "enum": ["st", "openai-embeddings", "fake"],
      "description": "Execution kind dispatched internally by EmbeddingClient. Drives how the index was built and how a query is re-embedded."
    },
    "embedding_model_id": {
      "type": "string",
      "minLength": 1,
      "description": "Model identifier the index was built with (ST id, e.g. 'BAAI/bge-m3', or a server-side model name, or the fake-provider sentinel)."
    },
    "embedding_model_revision": {
      "type": ["string", "null"],
      "description": "HF commit SHA / revision pin of the embedding model when resolvable (in-process ST), else null (server-side models, fake provider). Optional in practice but always present in the dict (null when unknown)."
    },
    "embedding_dim": {
      "type": "integer",
      "minimum": 1,
      "description": "Embedding dimensionality. Must equal embeddings.npy's column count (validator cross-checks)."
    },
    "normalized": {
      "type": "boolean",
      "const": true,
      "description": "Whether the stored row vectors are L2-normalized. Const true in 1.0 (exact cosine == dot product on unit vectors)."
    },
    "index_type": {
      "type": "string",
      "enum": ["exact-numpy"],
      "description": "Index engine. Const-style enum 'exact-numpy' in 1.0 (pure-numpy brute-force exact cosine search); the enum reserves room for a future ANN backend without a schema-version bump of the rest of the contract."
    },
    "chunker_version": {
      "type": "string",
      "pattern": "^(?:v\\d+|\\d+\\.\\d+\\.\\d+(?:[+-][A-Za-z0-9.+-]+)?)$",
      "description": "Chunker-schema-contract version of the chunks that were embedded (Trainforge.chunker.CHUNKER_SCHEMA_VERSION, e.g. 'v4'). Pattern alternation accepts both the 'v4' contract form and the legacy semver form for back-compat — mirrors chunkset_manifest.schema.json."
    },
    "chunkset_kind": {
      "type": "string",
      "enum": ["imscc", "semantik", "dart", "corpus-legacy"],
      "description": "Which resolved chunkset was embedded. 'imscc' (imscc_chunks/), 'semantik' (semantik_chunks/, the active staged-conversion emit dir), 'dart' (legacy dart_chunks/, read-only fallback), or 'corpus-legacy' (pre-Phase-7c corpus/ dir). Resolved via lib.libv2_storage.resolve_imscc_chunks_dir precedence unless the build was pinned with --chunkset."
    },
    "source_chunks_sha256": {
      "type": "string",
      "pattern": "^[0-9a-f]{64}$",
      "description": "SHA-256 (hex, lowercase) of the chunks.jsonl that was embedded. The load-bearing staleness signal: load_vector_index recomputes the live chunkset SHA and raises SemanticIndexStale on mismatch (anti-silent-degradation)."
    },
    "embeddings_sha256": {
      "type": "string",
      "pattern": "^[0-9a-f]{64}$",
      "description": "SHA-256 (hex, lowercase) of embeddings.npy bytes. Validator + verify re-hash the on-disk file and fail closed on tamper."
    },
    "id_map_sha256": {
      "type": "string",
      "pattern": "^[0-9a-f]{64}$",
      "description": "SHA-256 (hex, lowercase) of id_map.json bytes."
    },
    "chunks_count": {
      "type": "integer",
      "minimum": 0,
      "description": "Number of embedded chunks. Invariant: chunks_count == len(id_map.chunk_ids) == embeddings.shape[0]."
    },
    "parent_chunks_count": {
      "type": "integer",
      "minimum": 0,
      "description": "W1b.2 SPLIT arm (ED4ALL_EMBED_OVERFLOW_SPLIT) only: number of SOURCE chunks behind the embedded rows, when over-window chunks were sliced into sub-window pieces at build time. chunks_count stays the ROW count (the load-path invariant chunks_count == len(id_map.chunk_ids) == embeddings.shape[0] is unchanged), so parent_chunks_count < chunks_count whenever it is present. Omitted entirely when no row was split, which keeps every split-off manifest byte-identical."
    },
    "text_field_policy": {
      "type": "string",
      "enum": ["text+heading", "text", "retrieval_text"],
      "description": "What string was embedded per chunk. 'text+heading' (default, D6: section_heading + newline + text), 'text' (body only), or 'retrieval_text' (BM25-tuned summary; reserved A/B arm). Recorded so a re-pin is unambiguous and an eval run can refuse mixed-policy comparisons."
    },
    "batch_size": {
      "type": "integer",
      "minimum": 1,
      "description": "Encode batch size used at build time. A replay parameter (determinism contract). Sourced from the embedding client's own reported provenance — the build path raises rather than substituting a default, so this value is a measurement and never a placeholder."
    },
    "device": {
      "type": "string",
      "minLength": 1,
      "description": "Where the embedding compute actually ran at build time. 'cpu' or 'cuda' / 'cuda:N' for the in-process sentence-transformers kind (cuda is the product default), and 'server' for a remote OpenAI-compatible embeddings endpoint, whose device is not observable from here. Recorded so a mixed-device comparison can be refused: byte-identity of embeddings.npy holds only within a fixed device+dtype+batch_size, because GPU reductions are not associative. Sourced from the client's reported provenance — the build path raises rather than substituting a default."
    },
    "dtype": {
      "type": "string",
      "enum": ["fp32", "bf16", "fp16", "server"],
      "description": "Encoder compute precision at build time: 'fp32' | 'bf16' | 'fp16' for the in-process sentence-transformers kind, or the 'server' sentinel for a remote OpenAI-compatible embeddings endpoint whose precision this process cannot observe (mirroring the same sentinel on device). Optional: omitted by clients that predate the precision seam (absent == unknown, NOT 'assume fp32'), which keeps every pre-seam manifest byte-identical. When present it is part of the replay identity alongside device and batch_size — a bf16-built index is not bit-comparable to an fp32-built one, and the query path refuses a client whose dtype disagrees. Note this is the ENCODER precision; the stored matrix is always float32 (see index_type / normalized)."
    },
    "document_prefix": {
      "type": "string",
      "description": "Asymmetric-retrieval passage prefix prepended to every embedded passage at build time (e.g. nomic's 'search_document: '). Empty string for symmetric models (and for bge, whose instruction prefix is query-side only). Recorded so a rebuild/eval can reproduce the exact passage encoding and refuse mixed-prefix comparisons. Optional for back-compat (pre-prefix manifests omit it; absent == '')."
    },
    "query_prefix": {
      "type": "string",
      "description": "Asymmetric-retrieval query prefix applied query-side at search time (e.g. nomic's 'search_query: ', bge's 'Represent this sentence for searching relevant passages: '). Recorded alongside document_prefix for full replay provenance of the query/passage asymmetry. Optional for back-compat (absent == '')."
    },
    "generated_at": {
      "type": "string",
      "format": "date-time",
      "description": "ISO 8601 timestamp (UTC) of the build. Optional, and deliberately EXCLUDED from the byte-stable determinism contract (a rebuild over identical inputs differs only in this field)."
    },
    "embed_overflow": {
      "type": "object",
      "description": "W1b.2 (opt-in ED4ALL_EMBED_OVERFLOW_GUARD) over-window accounting block, stamped at build time when the guard is on. Records which embedded passages exceed the serving-window token ceiling (ED4ALL_EMBED_MAX_SEQ_TOKENS) so a post-hoc audit can see silent truncation. The count fields always describe the ROWS THAT WERE EMBEDDED — with the split arm on that makes overflow_count the RESIDUAL after slicing (a single word wider than the window cannot be split without corrupting it), and the parent-level view lives in the split-only fields. Counts are exact wordpiece when the build client exposed a tokenizer (EmbeddingClient.token_counter()) and the documented words x 1.3 estimate otherwise. Omitted entirely when the guard is off (byte-identical off-path); part of the determinism content hash when present (real build provenance).",
      "properties": {
        "max_seq_tokens": {"type": "integer", "minimum": 1},
        "records_scanned": {"type": "integer", "minimum": 0},
        "overflow_count": {"type": "integer", "minimum": 0},
        "overflow_rate": {"type": "number", "minimum": 0, "maximum": 1},
        "max_observed_tokens": {"type": "integer", "minimum": 0},
        "overflow_chunk_ids": {"type": "array", "items": {"type": "string"}},
        "split_enabled": {"type": "boolean", "description": "SPLIT arm only (ED4ALL_EMBED_OVERFLOW_SPLIT). Present and true only when over-window passages were sliced before encoding; absent entirely on the count-only path."},
        "split_window_tokens": {"type": "integer", "minimum": 1, "description": "SPLIT arm only. Per-piece token budget the slicer packed against: max_seq_tokens minus the document_prefix cost, since the prefix is encoded with every row and would otherwise re-introduce truncation."},
        "parent_records_scanned": {"type": "integer", "minimum": 0, "description": "SPLIT arm only. Number of SOURCE chunks scored before slicing (records_scanned counts the post-split rows)."},
        "pre_split_overflow_count": {"type": "integer", "minimum": 0, "description": "SPLIT arm only. Source chunks that exceeded the window and were therefore sliced — the measured motivation for the arm."},
        "sub_pieces_created": {"type": "integer", "minimum": 0, "description": "SPLIT arm only. Total sub-window pieces emitted in place of the sliced parents (each carries its own vector and an id of the form '<parent_id>#p<n>', collapsed back to the parent at query time)."}
      },
      "required": ["max_seq_tokens", "records_scanned", "overflow_count", "overflow_rate", "max_observed_tokens", "overflow_chunk_ids"],
      "additionalProperties": false
    }
  },
  "additionalProperties": false
}
